{"approved_decision_sha256":"ed9cdc3d2b51385a0a7bf22cb3d4451f65c8246faed2baf84b4ba4d8bd4ed61e","execution_manifest_sha256":"2984caaa5b239ade122795836daf9a192274668b9ae3ccaeba026eee004ec052","frozen_at":"2026-10-05T12:35:00.000Z","payment_sha256":"18f12b6f93070e70fb9e12d069e2dd265c2404aff207f5a9d65278ac5c2e332d","record_type":"trial_manifest","resource_manifest_sha256":"91314d83919d4752cc8f7f67cdb5f6a2451c3175ad635b9741fe8c450dfd942f","run_id":"b42ee7a8-4b45-43d7-8ca3-cb72ceae84c4","scenario":"COMMIT_THEN_TIMEOUT","schema_version":1,"sequence":3,"trial_id":"1549b47d-5c04-4f8c-98f1-789a4dc2eda2","variant_id":"conventional"}
