{"approved_decision_sha256":"ed9cdc3d2b51385a0a7bf22cb3d4451f65c8246faed2baf84b4ba4d8bd4ed61e","execution_manifest_sha256":"3d26529048074578c43c303781c3ff54d17c0f4f22f6916fa1348955b66f202e","frozen_at":"2026-10-07T06:06:20.842Z","payment_sha256":"18f12b6f93070e70fb9e12d069e2dd265c2404aff207f5a9d65278ac5c2e332d","record_type":"trial_manifest","resource_manifest_sha256":"4a358d19a0af1f2a037c704fbcd20c900855154fc2f60c7399822c2f63cc6738","run_id":"abf41ffd-3008-4b29-81ee-b65d8095188b","scenario":"CONTROL","schema_version":1,"sequence":1,"trial_id":"7fd96973-1eed-4982-8a4e-b654680ce404","variant_id":"conventional"}
