{"approved_decision_sha256":"ed9cdc3d2b51385a0a7bf22cb3d4451f65c8246faed2baf84b4ba4d8bd4ed61e","execution_manifest_sha256":"c39605d9b960dacf90d6d55523843d7e08b0e9def09fdbcb0b0263ea191986df","frozen_at":"2026-10-07T05:47:25.761Z","payment_sha256":"18f12b6f93070e70fb9e12d069e2dd265c2404aff207f5a9d65278ac5c2e332d","record_type":"trial_manifest","resource_manifest_sha256":"5606762715a4e3b2e9c15b4e49fa8a04442e4e4313529476132c84f4fb5567ec","scenario":"CONTROL","schema_version":1,"sequence":1,"trial_id":"abe77042-33ec-4391-8ea3-b655873aff45","variant_id":"durable","variant_validation_id":"60511328-ab4d-4234-81ab-0b042a20e658"}
