{"approved_decision_sha256":"ed9cdc3d2b51385a0a7bf22cb3d4451f65c8246faed2baf84b4ba4d8bd4ed61e","execution_manifest_sha256":"5ea4e7511b1528b46c6b7f3a3e0d6e1819a39ed832467ba33840a88198fc1afa","frozen_at":"2026-10-07T05:13:15.383Z","payment_sha256":"18f12b6f93070e70fb9e12d069e2dd265c2404aff207f5a9d65278ac5c2e332d","record_type":"trial_manifest","resource_manifest_sha256":"07e23452e34d683b1ed3a62c16f92c339238807b5e7dc4e911caa75362ecdf68","scenario":"CONTROL","schema_version":1,"sequence":1,"trial_id":"7aeb0d62-5c7e-4494-9002-0063c4e65f03","variant_id":"durable","variant_validation_id":"eda6019a-0f5d-4565-a809-b129ec432036"}
