{"approved_decision_sha256":"ed9cdc3d2b51385a0a7bf22cb3d4451f65c8246faed2baf84b4ba4d8bd4ed61e","execution_manifest_sha256":"af35e6d638e19a1746b17b1146bcd86c0e64a5f88c8518c79067e5d9cfd18540","frozen_at":"2026-10-05T12:20:00.000Z","payment_sha256":"18f12b6f93070e70fb9e12d069e2dd265c2404aff207f5a9d65278ac5c2e332d","record_type":"trial_manifest","resource_manifest_sha256":"4dfb65bfe843cad00a0dfe6e8d82436d9077f315d413770a5598ce6095c67bcc","scenario":"COMMIT_THEN_TIMEOUT","schema_version":1,"sequence":2,"trial_id":"84967662-0cff-40dc-ba3f-b3191b714406","variant_id":"durable","variant_validation_id":"0a057d57-a288-41ea-a709-6b6fb3e9cfdb"}
