{"approved_decision_sha256":"ed9cdc3d2b51385a0a7bf22cb3d4451f65c8246faed2baf84b4ba4d8bd4ed61e","execution_manifest_sha256":"9475cbad9d915c4157feb352837acfbb9a8858103d6e695396355e1ab6f3a624","frozen_at":"2026-10-05T12:20:00.000Z","payment_sha256":"18f12b6f93070e70fb9e12d069e2dd265c2404aff207f5a9d65278ac5c2e332d","record_type":"trial_manifest","resource_manifest_sha256":"ab3d118917be1c6edfa8bd800d13648c70fde800f09b8dd2f7dedfe5ea43b96b","run_id":"b42ee7a8-4b45-43d7-8ca3-cb72ceae84c4","scenario":"CONTROL","schema_version":1,"sequence":2,"trial_id":"af5fd7e2-4950-41df-baea-6ae3a692a869","variant_id":"durable"}
